New York,18,880330,"PARTS OF AIRPLANES OR HELICOPTERS, NESOI",351.14,387.43,378.11,374.01
New York,19,847590,PARTS OF MACH FOR ASSMBL,409.71,278.54,434.69,370.13
New York,20,740400,COPPER WASTE AND SCRAP,291.49,221.36,285.9,354.69
New York,21,300290,HUMAN BLOOD; ANIMAL BLOOD PR,4.05,3.76,210.33,338.05
New York,22,330300,PERFUMES AND TOILET WATERS,335.91,393.27,376.62,337.68
New York,23,710399,"SEMIPRECIOUS STONES, OTHERWISE WORKED",211.44,226.1,340.18,333.33
New York,24,710691,"SILVER, UNWROUGHT NESOI",128.02,149.64,33.24,325.28
New York,25,847150,"DIGITAL PROCESSING UNITS, N.E.S.O.I.",243.08,271.04,265.51,323.94
Ohio,0,0,World,51261.86,49330.26,50102.78,54292.82
Ohio,0,25,Top 25,17826.49,17609.39,18020.12,20449.34
Ohio,1,880000,"CIVILIAN AIRCRAFT, ENGINES, AND PARTS",4969.67,4676.33,4806.33,5177.25
Ohio,2,870324,PASS VEH SPK-IG INT COM RCPR P ENG > 3000 CC,1958,1915.92,1625.86,1614.43
Ohio,3,120190,"SOYBEANS, NESOI",1702.29,2079.25,1755.64,1603.66
Ohio,4,840734,SPARK-IGNTN RECPRCTING PISTON ENGINE,1365.14,1668.71,1526.32,1245.82
Ohio,5,870322,"PASS MTR VEH,SPARK IGN EN",277.37,189.2,462.32,1121.68
Ohio,6,870829,"PTS & ACCESS OF BODIES OF MOTOR VEHICLES, NESOI",1030.44,1072.04,1029.08,1116.98
Ohio,7,870323,PASS VEH SPK-IG INT COM R,1064.51,926.45,824.97,1028.53
Ohio,8,870840,GEAR BOXES FOR MOTOR VEHICLES,497.87,455.33,566.95,812.02
Ohio,9,240220,CIGARETTES CONTAINING TOBACCO,331.14,518.36,604.2,732.01
Ohio,10,847150,"DIGITAL PROCESSING UNITS, N.E.S.O.I.",39.07,32.97,100.3,584.66
Ohio,11,847130,PORT DIGTL AUTOMATIC DA,41.36,36.89,125.68,574.92
Ohio,12,870899,"PARTS AND ACCESSORIES OF MOTOR VEHICLES, NESOI",692.85,525.09,500.35,509.72
Ohio,13,300490,"MEDICAMENTS NESOI, MEASURED DOSES, RETAIL PK NESOI",427.14,345.38,472.64,482.94
Ohio,14,340220,"SURFACE-ACTIVE, WASHING ETC PREP ETC, RETAIL SALE",424.13,411.69,370.12,417.19
Ohio,15,870120,ROAD TRACTORS FOR SEMI-TRAILERS,318.63,223.27,336.86,395
Ohio,16,870880,SUSPENSION SHOCK ABSORBERS FOR MOTOR VEHICLES,348.54,341.44,345.44,360.37
Ohio,17,392099,"PLATES ETC, NONCELL, NT REIN, OF PLASTICS NESOI",316.37,282.87,379.29,345.54
Ohio,18,840991,SPARK-IGNITION INT COMBUSTION PISTON ENG PTS NESOI,324.3,275.8,292,329.38
Ohio,19,848180,TAPS COCKS ETC F PIPE VAT INC THERMO CONTROL NESO,285.21,273.39,289.48,319.4
Ohio,20,330499,BEAUTY & SKIN CARE PREPARATI,156.58,202.2,268.04,313.59
Ohio,21,961900,SANITARY TOWELS AND TAMPONS DIAPERS FOR BABIES ETC,275.58,261.45,270.67,304.34
Ohio,22,841182,"GAS TURBINES OF A POWER EXCEEDING 5,000 KW",483.36,430.24,357.91,302.44
Ohio,23,853710,CONTROLS ETC W ELECT APPR,191.81,173.27,245.31,255.7
Ohio,24,382499,"PRODUCTS AND RESIDUALS OF CHEMICAL INDUSTRY, NESOI",0,0,209.43,254.24
Ohio,25,870830,BRAKES AND SERVO-BREAKS; PARTS THEREOF,305.12,291.83,254.92,247.55
Oklahoma,0,0,World,5250.68,5046.08,5364.37,6102.43
Oklahoma,0,25,Top 25,1864.76,1792.57,2234.66,2842.8
Oklahoma,1,880000,"CIVILIAN AIRCRAFT, ENGINES, AND PARTS",426.89,469.18,572.23,596.18
Oklahoma,2,381512,SUPPORTED CATALYSTS W PREC METAL/PREC MTL COMPND,72.93,57.56,84.14,219.78
Oklahoma,3,520100,"COTTON, NOT CARDED OR COMBED",37.86,52.81,113.38,165.81
Oklahoma,4,870210,MV TRNSP >TEN PRSNS COM-IGNTN,119.01,120.28,73.08,139.06
Oklahoma,5,841391,PARTS OF PUMPS FOR LIQUIDS,114.09,79.28,115.71,129.31
Oklahoma,6,848180,TAPS COCKS ETC F PIPE VAT INC THERMO CONTROL NESO,114.52,84.97,124.13,118.54
Oklahoma,7,841191,TURBOJET AND TURBOPROLLER PARTS,3.19,1.91,9.04,116.08
Oklahoma,8,847170,"AUTOMATIC DATA PROCESSING STORAGE UNITS, N.E.S.O.I",127.83,116.52,158.98,116.07
Oklahoma,9,20319,"MEAT OF SWINE, NESOI, FRESH OR CHILLED",78.95,102.88,109.86,107.07
Oklahoma,10,841950,"HEAT EXCHANGE UNITS, INDUSTRIAL TYPE",97.91,76.29,87.7,96.23
Oklahoma,11,100199,"WHEAT AND MESLIN, NESOI",47.72,53.34,67.77,91.72
Oklahoma,12,852351,SOLID-STATE NON-VOL SEMICONDUCTOR STORAGE DEVICES,3.19,6.92,62.86,81.66
Oklahoma,13,851660,"OVEN,COOKING STOVE & PLATE,RANGE,ROASTER, NESOI",64.1,73.15,78.07,79.96
Oklahoma,14,851762,MACH FOR RECP/CONVR/TRANS/R,65.94,67.81,73.3,79.1
Oklahoma,15,847330,PARTS & ACCESSORIES FOR ADP M,46.66,38.58,73.19,76.34
Oklahoma,16,841582,AIR CONDITIONING MACH ETC INCORP REFRIG UNIT NESOI,73.2,75.21,68.08,71.45
Oklahoma,17,350400,"PEPTONES, OTHER PROTEINS & DERIV ETC; HIDE POWDER",51.94,56.9,71.41,70.59
Oklahoma,18,300490,"MEDICAMENTS NESOI, MEASURED DOSES, RETAIL PK NESOI",20.88,19,19.02,65.4
Oklahoma,19,853710,CONTROLS ETC W ELECT APPR,17.62,32.76,36.88,65.08
Oklahoma,20,843143,"PARTS FOR BORING OR SINKING MACHINERY, NESOI",104.64,56.99,55.57,64.22
Oklahoma,21,20329,"MEAT OF SWINE, NESOI, FROZEN",29.81,39.69,56.07,61.74
Oklahoma,22,381190,"ADDITIVES FOR MINERAL OILS, NESOI",12.87,6.78,8.43,61.51
Oklahoma,23,841229,HYDRAULIC POWER ENGINES & MOTORS EX LINEAR ACTING,33.93,31.41,40.34,58.87
Oklahoma,24,271019,PETROL OIL BITUM MINERA,18.7,22.87,26.44,56.37
Oklahoma,25,854460,ELECTRIC CONDUCTORS FOR VOLTAGE EXCEEDING 1000 V,80.38,49.49,49.01,54.66
Oregon,0,0,World,20057.33,21771.7,21895.18,22292.68
Oregon,0,25,Top 25,11924.49,13136.14,14150.19,14505.33
Oregon,1,854231,"PROCESSORS AND CONTROLLERS, ELECTRONIC INTEG CIRCT",5409.5,6628.45,5147.08,4377.68
Oregon,2,848620,MACHINES FOR MAN. SEMICONDUTOR DEVICES/ELEC IC,1153.64,1372.19,2281.14,2147.08
Oregon,3,100199,"WHEAT AND MESLIN, NESOI",930.54,991.23,1003.2,1026.38
Oregon,4,310420,POTASSIUM CHLORIDE,628.37,344.03,654.79,922.91
Oregon,5,847150,"DIGITAL PROCESSING UNITS, N.E.S.O.I.",976.35,753.5,895.01,781.31
Oregon,6,880000,"CIVILIAN AIRCRAFT, ENGINES, AND PARTS",454.29,408.66,468.71,716.25
Oregon,7,870120,ROAD TRACTORS FOR SEMI-TRAILERS,143.2,75.28,121.56,704.21
Oregon,8,848690,"PARTS & ACCSESORIES FOR MACH TO MAN. SEMICNT, ETC",187.88,253.04,459.08,531.1
Oregon,9,300215,"IMMUNOLOGICAL PRODUCTS, IN MEASURED DOESE/RTL SALE",0,0,495.73,407.17
Oregon,10,854239,"ELECTRONIC INTEGRATED CIRCUITS, NESOI",433.93,437.46,513.65,379.4
Oregon,11,640690,PARTS FOOTWEAR REMOVABLE INSOLES G,193.22,205.73,292.58,377.25
Oregon,12,370242,"PHOT FLM NO SPROCKET HLS,OV 610MM& OV2",277.81,229.97,235.36,263.68
Oregon,13,870423,"TRUCK, DIESEL ENG, GVW > 20 METRIC TO",78.75,84.36,77.72,215.27
Oregon,14,854129,"TRANSISTORS, OTHER THAN PHOTOSENSITIVE, NESOI",151.8,174.31,194.09,210.77
Oregon,15,381800,"CHEM ELEM DOPED, USED IN ELECT",154.59,151.87,158.39,188.35
Oregon,16,121490,FORAGE PRODUCTS NESOI (HA,149.5,176.98,195.82,171.05
Oregon,17,200410,"POTATOES, PREPARED ETC., NO VINEGAR ETC., FROZEN",129.03,159.4,201.29,159.71
Oregon,18,440121,"WOOD IN CHIPS OR PARTICLES, CONIFEROUS",106.22,93.41,100.72,144.27
Oregon,19,100590,"CORN (MAIZE), OTHER THAN SEED CORN",12.09,56.73,72.72,139.9
Oregon,20,854232,"MEMORIES, ELECTRONIC INTEGRATED CIRCUITS",43.54,73.03,68.7,133.87
Oregon,21,903090,PTS OF INST F MEAS ELECT QUAT AL,112.94,113.32,96.86,115.09
Oregon,22,851762,MACH FOR RECP/CONVR/TRANS/R,84.29,97.71,223.94,100.27
Oregon,23,760200,ALUMINUM WASTE AND SCRAP,63.76,41.87,90.04,99.5
Oregon,24,120190,"SOYBEANS, NESOI",35.29,166.15,54.83,98.7
Oregon,25,854233,"AMPLIFIERS, ELECTRONIC INTEGRATED CIRCUITS",13.96,47.44,47.18,94.18
Pennsylvania,0,0,World,39439.36,36453.18,38701.91,41049.63
Pennsylvania,0,25,Top 25,9800.41,8663.96,11291.75,13489.2
Pennsylvania,1,270112,"BITUMINOUS COAL, NOT AGGLOMERATED",1303.56,1207.7,2632.11,2672.52
Pennsylvania,2,300220,VACCINES FOR HUMAN MEDICINE,993.17,740.1,807.12,1319.93
Pennsylvania,3,300490,"MEDICAMENTS NESOI, MEASURED DOSES, RETAIL PK NESOI",1126.82,1126.05,1067.36,1145.33
Pennsylvania,4,271112,"PROPANE, LIQUEFIED",386.28,582.41,790.56,1018.83
Pennsylvania,5,880000,"CIVILIAN AIRCRAFT, ENGINES, AND PARTS",1147.48,1026.81,731.13,758.91
Pennsylvania,6,300215,"IMMUNOLOGICAL PRODUCTS, IN MEASURED DOESE/RTL SALE",0,0,437.5,582.19
Pennsylvania,7,871150,"MOTORCYCLES, CYCL,EXCD 800 CC",542.37,547.36,513.49,494.97
Pennsylvania,8,901920,"OZONE,OXYGEN,ETC THERAPY, RES",415.15,444.66,472.95,438.1
Pennsylvania,9,851712,PHONES FOR CELLULAR NTWKS OR FOR OTH WIRELESS NTWK,616.14,352.45,474.14,392.65
Pennsylvania,10,284390,"ORGANIC COMPOUND PRECIOUS METAL; AMALGRAMS, NESOI",137.69,133.57,241.85,364.02
Pennsylvania,11,271019,PETROL OIL BITUM MINERA,344.48,193.99,276.46,360.87
Pennsylvania,12,860210,DIESEL ELECTRIC LOCOMOTIVES,454.52,227.11,456.78,345.18
Pennsylvania,13,392690,"ARTICLES OF PLASTICS, NESOI",319.73,304.73,312.71,319.29
Pennsylvania,14,850710,LEAD-ACID BATTERIES OF A KIND USED FOR STG ENGINES,221.46,211.32,276.74,318.68
Pennsylvania,15,853890,PT F ELECT APPR F ELECT CIRCT; F ELCT,298.52,268.56,293.81,312.08
Pennsylvania,16,842720,"SELF-PROPELLED WORKS TRUCKS AND FORKLIFTS, NESOI",295.16,205.07,243.15,301.07
Pennsylvania,17,871000,"TANK & OT ARMORED FIGHT VEH, MOTORIZED; AND PARTS",4.35,29.08,10.23,294.14
Pennsylvania,18,750512,"BARS, RODS AND PROFILES OF NICKEL ALLOYS",198.13,212.21,233.52,283.21
Pennsylvania,19,903300,"PTS, NESOI FOR MACHINES,APPLN,IN",122.67,110.03,168.66,278.02
Pennsylvania,20,880212,HELICOPTERS OF AN UNLADEN WEIGHT EXCEEDING 2000 KG,420.46,272.3,115.55,266.89
Pennsylvania,21,711011,"PLATINUM, UNWROUGHT OR POWDER",87.34,74.02,111.84,265.03
Pennsylvania,22,330499,BEAUTY & SKIN CARE PREPARATI,44.4,54.09,69.85,252.57
Pennsylvania,23,711021,"PALLADIUM, UNWROUGHT OR IN POWDER FORM",78.49,58.16,120.75,251.64
Pennsylvania,24,290110,"ACYCLIC HYDROCARBONS, SATURATED",31.69,138.57,222.62,232.34
Pennsylvania,25,843149,PARTS AND ATTACHMENTS NESOI FOR DERRI,210.34,143.6,210.88,220.77
Puerto Rico,0,0,World,20179.48,19871.94,15876.02,18147.59
Puerto Rico,0,25,Top 25,13541.88,12579.69,13733.25,16026.46
Puerto Rico,1,300490,"MEDICAMENTS NESOI, MEASURED DOSES, RETAIL PK NESOI",6733.52,6519.28,5387.61,6085.25
Puerto Rico,2,300215,"IMMUNOLOGICAL PRODUCTS, IN MEASURED DOESE/RTL SALE",0,0,2751.62,3937.46
Puerto Rico,3,293719,POLYPEPTIDE PROTEIN& GLYCOPROTEIN HORMONES &DERIV,1360.34,1109.61,1220.5,835.35
Puerto Rico,4,293712,INSULIN AND ITS SALTS,196.02,485.93,516.5,603.68
Puerto Rico,5,271019,PETROL OIL BITUM MINERA,197.55,315.97,343.27,534.03
Puerto Rico,6,293339,CMPDS CONT AN UNFUSED PYRIDINE RING ETC NESOI,1100.91,761.69,465.6,462.31
Puerto Rico,7,901890,"INSTR & APPL F MEDICAL SURGICAL DENTAL VET, NESOI",219.86,360.59,279.38,370.9
Puerto Rico,8,902190,OTH ARTIFICAL PTS OF THE BODY & PTS & ACCESSORIES,705.85,381.2,333.94,354.54
Puerto Rico,9,300439,HORMONES ETC. (NO ANTIBIOTICS C,375.71,213.87,188.57,295.58
Puerto Rico,10,300420,"ANTIBIOTICS NESOI, IN DOSAGE FORM",329.04,446.91,194.74,234.18
Puerto Rico,11,900130,CONTACT LENSES,167.93,164.22,200.66,227.26
Puerto Rico,12,902139,"ARTIFICIAL JOINTS & PARTS & ACCESSORIES THEROF,NES",408.5,429.89,316.86,196.92
Puerto Rico,13,293590,"SULPHONAMIDES, NESOI",0,0,128.29,196.69
Puerto Rico,14,292149,AROMATIC MONOAMINES NESOI AND THEIR DERIVATIV,366.09,146.86,136.59,195.07
Puerto Rico,15,293499,"NUCLEIC ACIDS & SALTS; OTHER HETEROCYCLIC CMP, NES",432.27,340.28,203.5,190.37
Puerto Rico,16,853890,PT F ELECT APPR F ELECT CIRCT; F ELCT,8.34,102.54,133.35,178.38
Puerto Rico,17,300212,ANTISERA AND OTHER BLOOD FRACTIONS,0,0,138.41,178.36
Puerto Rico,18,294190,"ANTIBIOTICS, NESOI",226.44,94.05,134.41,175.11
Puerto Rico,19,293711,"SOMATOTROPIN, ITS DERIVATIVES & STRUCTUAL ANALOGUE",132.95,75.21,81.25,129.9
Puerto Rico,20,382200,"COMPOSITE DIAGNOSTIC/LAB REAGENTS, EXC PHARMACEUT",102.44,116.73,118.71,129.2
Puerto Rico,21,854442,"ELEC CONDUCTORS, LT=1000 V, W/ CONNECTORS, NESOI",0.25,85.94,100.33,124.76
Puerto Rico,22,293729,ADRENAL CORTICAL HORMONES AND DERIV NESOI,214.05,129.2,96.94,103.64
Puerto Rico,23,901839,"MED NEEDLES. NESOI, CATHERERS ETC AND PARTS ETC",180.06,149.33,81.5,103.09
Puerto Rico,24,901819,ELECTRO-DIAGNOSTIC APPARA,83.74,106.42,113.51,100.69
Puerto Rico,25,902150,PACEMAKERS FOR STIMULATING HEART MUSCLES,0.03,43.97,67.21,83.76
Rhode Island,0,0,World,2132.71,2278.14,2391.71,2399.76
Rhode Island,0,25,Top 25,918.39,1091.46,1225.33,1408.12
Rhode Island,1,720449,FERROUS WASTE & SCRAP NESOI,139.29,117.86,186.19,244.24
Rhode Island,2,711299,WASTE AND SCRAP OF PRECIOUS METAL NESOI,137.45,153.14,155.09,187.99
Rhode Island,3,711319,"JEWELRY AND PARTS THEREOF, OF OTH PRECIOUS METAL",20.9,35.99,100.8,164.2
Rhode Island,4,711291,WASTE & SCRAP GOLD EXCL SWPNGS CNTNG OTH PREC MTLS,178.6,169.33,132.17,144.89
Rhode Island,5,710610,SILVER POWDER,84.87,174.08,128.16,100.84
Rhode Island,6,300213,"IMMUNOLOGICAL PRODUCTS, UNMIXED, NOT IN MSRE DOSES",0,0,84.35,96.39
Rhode Island,7,711311,"JEWELRY AND PARTS THEREOF, OF SILVER",32.72,93.5,91.28,65.68
Rhode Island,8,284330,GOLD COMPOUNDS,49.31,54.84,59.49,60.06
Rhode Island,9,711719,"OTH IMITATION JEWELRY, BASE METAL, INC PR MTL PLTD",70.28,61.06,41.86,42.48
Rhode Island,10,370790,"CHEM PREP,PHOTO USE, MEAS/RTL SALE,",15.25,16.21,20.54,23.17
Rhode Island,11,847989,MACH & MECHANICAL APPL W INDIVIDUAL FUNCTION NESOI,18.97,16.31,20.15,21.41
Rhode Island,12,847990,PTS OF MACH/MECHNCL APPL W INDVDUL FUNCTION NESOI,19.28,19.53,18.74,20.22
Rhode Island,13,392020,"PLATES, SHEETS ETC, NON-CELL ET",20.4,19.99,18.79,20.17
Rhode Island,14,850440,STATIC CONVERTERS; ADP POWER SUPPLIES,25,24.84,16.74,20.03
Rhode Island,15,870899,"PARTS AND ACCESSORIES OF MOTOR VEHICLES, NESOI",12.1,16.39,21.75,19.59
Rhode Island,16,852910,ANTENNAS AND ANTENNA REFLECTORS AND PARTS,2.41,2.21,3.16,19.48
Rhode Island,17,300212,ANTISERA AND OTHER BLOOD FRACTIONS,0,0,17.2,19.4
Rhode Island,18,848420,MECHANICAL SEALS,7.39,8.69,16.04,18.35
Rhode Island,19,600410,"KNIT/CROC FAB,WD>30 CM, CONT 5",14.41,18.33,15.36,18.14
Rhode Island,20,390422,"POLYMERS NESOI OF POLYVINYL CHLORIDE, PLASTICIZED",22.12,17.51,17.85,17.93
Rhode Island,21,950691,"ARTCL/EQUIP F GEN PHYS EXERC, GYMN ETC NESOI; PTS",11.22,14.42,15.18,17.55
Rhode Island,22,890399,YACHTS ETC FOR PLEAS/SPORT NESOI,4.33,1.3,4.98,16.82
Rhode Island,23,842121,WATER FILTERING OR PURIFYING MACHINERY & APPARATUS,14.04,20.42,19.23,16.72
Rhode Island,24,848180,TAPS COCKS ETC F PIPE VAT INC THERMO CONTROL NESO,8.74,15.26,19.04,16.28
Rhode Island,25,220710,"ETHYL ALCOHOL, UNDENAT, ALCHOL NOT UN 80% BY VOLUM",9.33,20.25,1.21,16.12
South Carolina,0,0,World,31021.19,31323.57,32199.07,34637.03
South Carolina,0,25,Top 25,18113.31,19364.24,20186,22194.52
South Carolina,1,880000,"CIVILIAN AIRCRAFT, ENGINES, AND PARTS",3886.76,5587.73,6275.81,7906.12
South Carolina,2,870323,PASS VEH SPK-IG INT COM R,4305.13,4527.83,3036.77,3054.02
South Carolina,3,870333,PASS VEH COM-IG INT COM ENG > 2500 CC,2691.94,2440.16,2311.28,2223.11
South Carolina,4,870332,PASS VEH COM-IG INT COM,2359.42,2194.18,1817.64,1907.48
South Carolina,5,870324,PASS VEH SPK-IG INT COM RCPR P ENG > 3000 CC,411.31,284.61,1189.42,938.84
South Carolina,6,870840,GEAR BOXES FOR MOTOR VEHICLES,605.98,685.57,918.16,875.27
South Carolina,7,401180,NEW PNEUMATC RUB TIRES USED ON CONSTRUC/MINING/IND,0,0,629.07,828.59
South Carolina,8,847990,PTS OF MACH/MECHNCL APPL W INDVDUL FUNCTION NESOI,94.29,211.2,420.45,599.4
South Carolina,9,401110,"NEW PNEUMATIC TIRES OF RUBBER, FOR MOTOR CARS",500.02,487.2,499.68,444.02
South Carolina,10,870829,"PTS & ACCESS OF BODIES OF MOTOR VEHICLES, NESOI",160.03,187.09,240.86,347.63
South Carolina,11,470321,"CHEMICAL WOODPULP, SODA ETC. N DIS S BL & BL CONIF",351.42,329.92,378.93,345.23
South Carolina,12,401120,"NEW PNEUMATIC TIRES OF RUBBER, FOR BUSES OR TRUCKS",768.41,365.08,334.12,313.39
South Carolina,13,841199,GAS TURBINE PARTS NESOI,430.47,485.32,376.97,292.88
South Carolina,14,841182,"GAS TURBINES OF A POWER EXCEEDING 5,000 KW",462.46,467.56,217.67,285.24
South Carolina,15,20714,"CHICKEN CUTS AND EDIBLE OFFAL (INC LIVERS), FROZEN",86.53,116.56,201.62,234.53
South Carolina,16,870360,"MTR VEH, SP-IG AND ELECTRIC MOTOR, CHARGED BY PLUG",0,0,262.89,224.29
South Carolina,17,870899,"PARTS AND ACCESSORIES OF MOTOR VEHICLES, NESOI",78.72,104.52,166.04,199.26
South Carolina,18,480411,"KRAFTLINER, UNCOATED UNBLEACHED IN ROLLS OR SHEETS",164.49,161.28,141.8,172.61
South Carolina,19,870830,BRAKES AND SERVO-BREAKS; PARTS THEREOF,125.16,143.29,160.83,159.17
South Carolina,20,151790,EDIBLE FATS & OIL MIXTUR,142.74,136.94,138.73,148.01
South Carolina,21,902710,GAS OR SMOKE ANALYSIS APPARATUS,98.58,100.5,96.45,147.87
South Carolina,22,390810,"POLYAMIDE-6,-11,-12,-6,6,-6,9,-6,10 OR -6,12",83.42,78.15,123.06,141.5
South Carolina,23,390120,POLYETHYLENE HAVING A SPEC GRAVITY OF 0.94 OR MORE,12.01,8.15,28.1,139.84
South Carolina,24,848220,"TAPERED ROLL BRG, INCL CONE & ROLLER ASSEMBLIES",106.57,94.15,104.75,135.27
South Carolina,25,901813,MAGNETIC RESONANCE IMAGING APPARATUS,187.44,167.25,114.89,130.95
South Dakota,0,0,World,1420.51,1218.05,1359.71,1437.23
South Dakota,0,25,Top 25,742.8,669.12,788,867.74
South Dakota,1,230330,"BREWING OR DISTILLING DREGS AND WASTE, W/NT PELLET",95.84,87.9,90.82,103.74
South Dakota,2,230400,"SOYBEAN OILCAKE & OTH SOLID RESIDUE,",90.57,88.66,84.36,91.45
South Dakota,3,220720,ETHYL ALCOHOL & OTH SPIRITS DENATURED ANY STRENGTH,1.12,1.07,47.02,70.41
South Dakota,4,842951,"MECH FRONT-END SHOVEL LOADERS, SELF-PROPELLED",44.5,40.66,55.01,61.96
South Dakota,5,20319,"MEAT OF SWINE, NESOI, FRESH OR CHILLED",61.73,64.42,64.13,57.7
South Dakota,6,120190,"SOYBEANS, NESOI",19.72,0.03,5,43.26
South Dakota,7,20130,"MEAT OF BOVINE ANIMALS, BONELESS, FRESH OR CHILLED",27.88,24.29,32.44,38.08
South Dakota,8,250810,"BENTONITE, INCLUDING CALCINED",35.5,25.89,36.1,36.31
South Dakota,9,20312,"MEAT, SWINE, HAMS, SHLDRS, BONE IN, FRSH OR CHLLD",62.34,71.53,72.55,34.72
South Dakota,10,870530,FIRE FIGHTING VEHICLES,66.1,27.26,35.27,33.05
South Dakota,11,842833,"CONT-ACT ELEV & CONVEY,FR GOODS OR MATL,BELT TYPE",21.71,10.56,30.52,30.09
South Dakota,12,20329,"MEAT OF SWINE, NESOI, FROZEN",47.53,35.99,25.74,28.58
South Dakota,13,852859,"MONITORS, NOT INCORP TELEVISION RECEP APP, NESOI",30.89,24.97,29.83,27.14
South Dakota,14,391990,"PLATES, SHEETS, FILM ETC, PLASTICS, SELF-ADH NESOI",7.49,6.02,9.08,23.1
South Dakota,15,392010,"PLATES, SHEETS ETC, NON-CELL ETC",4.16,5.4,15.71,20.09
South Dakota,16,50400,"ANIMAL (NOT FISH) GUTS, BLADDERS, S",12.11,13.36,17.45,19.89
South Dakota,17,230910,"DOG AND CAT FOOD, PUT UP FOR RETAIL SALE",14.61,15.39,19.32,18.92
South Dakota,18,20649,"OFFAL OF SWINE EXCEPT LIVERS, EDIBLE, FROZEN",12.23,15.1,13.97,18.34
South Dakota,19,842890,"LIFTING, HANDLING, LOADING & UNLOADING MACHY NESOI",7.32,35.91,24.97,18.16
South Dakota,20,841459,"FANS, NESOI",22.44,17.03,18.98,17.27
South Dakota,21,871690,"PTS TRAILERS, SEMI-TRAILER & OT VEH N MECH PROPELD",15.35,12.48,13.29,16.3
South Dakota,22,870829,"PTS & ACCESS OF BODIES OF MOTOR VEHICLES, NESOI",11.96,12.08,17.23,15.67
South Dakota,23,20629,"OFFAL OF BOVINE ANIMALS, EDIBLE, NESOI, FROZEN",12.78,12.66,14.31,15.14
South Dakota,24,852990,"PTS,EX ANTENNA,FOR TRNSMSSN,",8.12,11.48,6.13,14.45
South Dakota,25,871639,TRAILERS & SEMI-TRAILER F TRANS CDS NESOI,8.82,8.97,8.77,13.93
Tennessee,0,0,World,32616.85,31494.71,33246.13,32703.15
Tennessee,0,25,Top 25,13883.91,13710.15,14985.37,14460.62
Tennessee,1,901890,"INSTR & APPL F MEDICAL SURGICAL DENTAL VET, NESOI",2218.55,2399.27,2308.17,2355.31
Tennessee,2,880000,"CIVILIAN AIRCRAFT, ENGINES, AND PARTS",1297.82,1203.22,1586.63,1456.27
Tennessee,3,870324,PASS VEH SPK-IG INT COM RCPR P ENG > 3000 CC,1184.86,1270.72,1477.72,1371.09
Tennessee,4,870323,PASS VEH SPK-IG INT COM R,1385.66,1311.58,1157.07,1188.48
Tennessee,5,520100,"COTTON, NOT CARDED OR COMBED",693.94,640.35,693,767.34
Tennessee,6,220830,WHISKIES,690.74,590.92,664.85,636.05
Tennessee,7,300610,"STERILE SURGICAL CATGUT, SIMILA",409.18,351.05,410.32,461.83
Tennessee,8,851712,PHONES FOR CELLULAR NTWKS OR FOR OTH WIRELESS NTWK,143.71,316.89,504.4,455.79
Tennessee,9,902110,"ORTHOPEDIC OR FRACTRE APPLIANCES, PARTS & ACCESSOR",492.69,452.28,405.64,439.46
Tennessee,10,847130,PORT DIGTL AUTOMATIC DA,811.84,690.28,770.76,431.98
Tennessee,11,550210,ARTIFICIAL FILAMNET TOW OF CELLULOSE ACETATE,0,0,439.73,424.48
Tennessee,12,840734,SPARK-IGNTN RECPRCTING PISTON ENGINE,895.98,811.4,701.23,418
Tennessee,13,480411,"KRAFTLINER, UNCOATED UNBLEACHED IN ROLLS OR SHEETS",227.82,242.2,320.53,390.06
Tennessee,14,902131,ARTIFICIAL JOINTS AND PARTS AND ACCESSORIES THEROF,333.32,391.06,424.78,381.92
Tennessee,15,840999,SPARK-IGNITION RECIPROCATING INT COM PISTN ENG PTS,346.59,365.24,331.5,341.96
Tennessee,16,390799,"POLYESTERS NESOI, UNSATURATED, PR FMS",285.42,289.36,307.19,335.59
Tennessee,17,840820,COMPRESSION-IGNTN INT COMBUST,295.36,257.75,242.25,332.76
Tennessee,18,711299,WASTE AND SCRAP OF PRECIOUS METAL NESOI,103.12,154.54,184.02,331.78
Tennessee,19,870899,"PARTS AND ACCESSORIES OF MOTOR VEHICLES, NESOI",476.88,400.57,358.75,317.19
Tennessee,20,391211,"CELLULOSE ACETATES, NONPLASTICIZED, PR FMS",333.36,318.62,293.18,309.5
Tennessee,21,382200,"COMPOSITE DIAGNOSTIC/LAB REAGENTS, EXC PHARMACEUT",233.7,220.61,255.33,290.04
Tennessee,22,320611,"PIGMNTS\PREPS CONT =>80% TITANIUM DIOXIDE, DRY WT",326.23,275.84,318.85,289.02
Tennessee,23,848180,TAPS COCKS ETC F PIPE VAT INC THERMO CONTROL NESO,169.73,183.62,258.89,251.28
Tennessee,24,840991,SPARK-IGNITION INT COMBUSTION PISTON ENG PTS NESOI,231.2,248.59,309.66,246.34
Tennessee,25,870894,"STEERING WHEELS, COLUMNS & BOXES F MOTOR VEHICLES",296.17,324.2,260.93,237.09
Texas,0,0,World,248780.41,231310.08,264541.38,315447.76
Texas,0,25,Top 25,105461.96,102177.04,131162.22,172974.62
Texas,1,270900,CRUDE OIL FROM PETROLEUM AND BITUMINOUS MINERALS,5733.39,4661.25,17039.18,38675.24
Texas,2,271019,PETROL OIL BITUM MINERA,24060.34,18308.02,23146.07,28078.72
Texas,3,271012,"LT OILS, PREPS GT=70% PETRO",17579.22,15814.62,18943.17,24739.36
Texas,4,271112,"PROPANE, LIQUEFIED",4808.25,6435.42,10903.35,13211.62
Texas,5,847330,PARTS & ACCESSORIES FOR ADP M,9912.22,10205.56,9587.57,10784.47
Texas,6,880000,"CIVILIAN AIRCRAFT, ENGINES, AND PARTS",5768.45,6830.95,7420.02,8611.23
Texas,7,854231,"PROCESSORS AND CONTROLLERS, ELECTRONIC INTEG CIRCT",5108.09,6036.27,5837.5,6270.71
Texas,8,851762,MACH FOR RECP/CONVR/TRANS/R,5148.36,5227.27,5039.26,4514.58
Texas,9,848620,MACHINES FOR MAN. SEMICONDUTOR DEVICES/ELEC IC,2259.26,2680.87,3684.53,3771.93
Texas,10,520100,"COTTON, NOT CARDED OR COMBED",1357.79,1734.66,3133.48,3301.16
Texas,11,847170,"AUTOMATIC DATA PROCESSING STORAGE UNITS, N.E.S.O.I",2087.66,2731.95,2711.41,2995.8
Texas,12,854239,"ELECTRONIC INTEGRATED CIRCUITS, NESOI",2520.22,2880.57,2741.85,2793.83
Texas,13,390120,POLYETHYLENE HAVING A SPEC GRAVITY OF 0.94 OR MORE,2194.39,2303.29,1915.22,2614.84
Texas,14,290919,ACYCLIC ETHERS (EXCL DIETHYL ETHER) NESOI,1952.34,1908.86,2198.1,2447.99
Texas,15,271113,"BUTANES, LIQUEFIED",749.5,868.18,1539.76,2293.88
Texas,16,271121,"NATURAL GAS, GASEOUS",1984.86,1783.05,2079.75,2280.12
Texas,17,390140,"ETHYLENE-ALPHA-OLEFIN COPOLY, SPC GRAVITY <0.94",0,0,1174.18,2107.71
Texas,18,840820,COMPRESSION-IGNTN INT COMBUST,333.37,622.87,1547.54,1984.04
Texas,19,847150,"DIGITAL PROCESSING UNITS, N.E.S.O.I.",1652.12,1734,1549.14,1748.92
Texas,20,290250,STYRENE,1756.54,1603.15,1507.82,1717.96
Texas,21,390110,POLYETHYLENE HAVING A SPECIFIC GRAVITY UNDER 0.94,1777.17,1527.47,1496.73,1667.75
Texas,22,870324,PASS VEH SPK-IG INT COM RCPR P ENG > 3000 CC,1832.57,1983.37,1289.4,1639.12
Texas,23,848180,TAPS COCKS ETC F PIPE VAT INC THERMO CONTROL NESO,2018.27,1437.12,1472.52,1638.55
Texas,24,852871,RECEPTION APP FOR TV NT DESIGNED TO INC VIDEO DISP,1583.91,1692.56,1942.85,1587.01
Texas,25,390410,"POLYVINYL CHLORIDE, NOT MIXED WITH OTHER SUBSTANCE",1283.68,1165.7,1261.81,1498.06
Utah,0,0,World,13307.64,12077.65,11583.3,14373.26
Utah,0,25,Top 25,9347.81,8326.66,7839.53,10463.14
Utah,1,710812,"GOLD, NONMONETARY, UNWROUGHT NESOI",5118.71,4518.28,3656.32,6136.24
Utah,2,854232,"MEMORIES, ELECTRONIC INTEGRATED CIRCUITS",1114.57,796.4,932.52,597.09
Utah,3,210690,FOOD PREPARATIONS NESOI,473.37,488.46,445.88,522.47
Utah,4,880000,"CIVILIAN AIRCRAFT, ENGINES, AND PARTS",302.32,258.71,410.22,373.74
Utah,5,870895,SAFETY AIRBAGS WITH INFLATOR SYSTEM; PARTS THEREOF,292.32,356.7,318.7,325.63
Utah,6,901839,"MED NEEDLES. NESOI, CATHERERS ETC AND PARTS ETC",227.75,283.82,319.68,320.91
Utah,7,270112,"BITUMINOUS COAL, NOT AGGLOMERATED",142.66,69.33,182.75,224.39
Utah,8,681510,NONELECTRICAL ARTICLES OF GRAPHITE OR CARBON NESOI,169.28,194.06,201.84,214.67
Utah,9,330499,BEAUTY & SKIN CARE PREPARATI,146.99,150.24,148.81,169.85
Utah,10,330129,"ESSENTIAL OILS, NESOI",76.35,97.7,128.51,154.3
Utah,11,902290,X-RAY/HI TNSN GENR CNTR PNL,202.95,221.35,192.54,138.92
Utah,12,902230,X-RAY TUBES,119.15,85.82,92.6,129.34
Utah,13,300490,"MEDICAMENTS NESOI, MEASURED DOSES, RETAIL PK NESOI",153.63,157.36,133.73,126.17
Utah,14,901890,"INSTR & APPL F MEDICAL SURGICAL DENTAL VET, NESOI",87.02,95.89,98.24,121.56
Utah,15,740311,REFINED COPPER CATHODES AND SECTIONS OF CATHODES,196.79,124.23,65.4,117.36
Utah,16,261390,MOLYBDENUM ORES AND CONCENTRATES NOT ROASTED,107.66,26.49,61.22,109.83
Utah,17,121490,FORAGE PRODUCTS NESOI (HA,81.87,70.62,76.86,108.27
Utah,18,51191,"PRODUCTS & DEAD FISH, MOLLUSCS ETC, INE",75.5,73.82,95.04,93.45
Utah,19,382200,"COMPOSITE DIAGNOSTIC/LAB REAGENTS, EXC PHARMACEUT",12.02,25.31,43.16,83.73
Utah,20,711291,WASTE & SCRAP GOLD EXCL SWPNGS CNTNG OTH PREC MTLS,10.03,0,0.01,76.76
Utah,21,360300,SAFETY FUSES; DETONATING FUSE; PERCUSSION CAPS ETC,126.79,111.12,83.66,72.73
Utah,22,20230,"MEAT OF BOVINE ANIMALS, BONELESS, FROZEN",27.5,32.96,39.73,72.67
Utah,23,902214,"APPTS BASE ON X-RAY, MEDICAL,SURGICAL,",31.55,25.2,37.43,61.17
Utah,24,902139,"ARTIFICIAL JOINTS & PARTS & ACCESSORIES THEROF,NES",20.98,27.85,36.81,58.28
Utah,25,853710,CONTROLS ETC W ELECT APPR,30.05,34.93,37.89,53.65
Virginia,0,0,World,17801.08,16310.98,16508.63,18357.71
Virginia,0,25,Top 25,6166.98,5589.78,6335.78,7702.82
Virginia,1,270112,"BITUMINOUS COAL, NOT AGGLOMERATED",638.58,484.97,896.41,1115.09
Virginia,2,854232,"MEMORIES, ELECTRONIC INTEGRATED CIRCUITS",716.85,559.69,635.24,736.09
Virginia,3,120190,"SOYBEANS, NESOI",586.24,698.4,595.33,700.79
Virginia,4,870120,ROAD TRACTORS FOR SEMI-TRAILERS,591.83,306.13,309.91,535.45
