Minnesota,5,901890,"INSTR & APPL F MEDICAL SURGICAL DENTAL VET, NESOI",251.2,269,306.04,425.87
Minnesota,6,851762,MACH FOR RECP/CONVR/TRANS/R,332.27,297.37,394.63,403.83
Minnesota,7,391990,"PLATES, SHEETS, FILM ETC, PLASTICS, SELF-ADH NESOI",297.72,293.74,341.53,399
Minnesota,8,842199,FILTER/PURIFY MACHINE & APPARATUS PARTS,412.35,334.04,341.75,374.54
Minnesota,9,854239,"ELECTRONIC INTEGRATED CIRCUITS, NESOI",106.73,108.78,157.47,337.79
Minnesota,10,854290,ELECTRONIC INTEGRATED CIRCUITS AND MCRSSMBLS PARTS,347.76,331.5,325.58,301.42
Minnesota,11,902190,OTH ARTIFICAL PTS OF THE BODY & PTS & ACCESSORIES,297.33,291.89,273.35,279.37
Minnesota,12,870310,PASS VEH FOR SNOW; GOLF CARTS & SIMILAR VEHICLES,269.28,217.44,220.77,237.35
Minnesota,13,300212,ANTISERA AND OTHER BLOOD FRACTIONS,0,0,101.11,218.38
Minnesota,14,901819,ELECTRO-DIAGNOSTIC APPARA,170.93,187.05,177.85,214.9
Minnesota,15,392690,"ARTICLES OF PLASTICS, NESOI",139.76,158.57,166.81,203.22
Minnesota,16,470200,"CHEMICAL WOODPULP, DISSOLVING GRADES",181.71,186.89,163.65,193.23
Minnesota,17,870590,"SPECIAL PURPOSE VEHICLES, NESOI",106.29,119.77,144.97,176.01
Minnesota,18,902620,"INST & APPRTS, MEASURING/CHECKING PRESSURE",170.33,142.26,153.14,172.99
Minnesota,19,902750,INSTRUMENTS ETC USING OPTICAL RADIATIONS NESOI,136.58,138.67,137.61,165.99
Minnesota,20,903180,"MEAS & CHECKNG INSTRUMENT, APPLIANCES & MACH NESOI",129.24,130.48,119.33,165.74
Minnesota,21,903141,OPTICAL INST FOR INSPECTING,140.34,128.25,162.12,164.43
Minnesota,22,120190,"SOYBEANS, NESOI",174.08,188.32,162.33,160.23
Minnesota,23,230990,"ANIMAL FEED PREP EXCEPT DOG OR CAT FOOD, RETAIL PK",127.88,141.66,151.42,155.77
Minnesota,24,230400,"SOYBEAN OILCAKE & OTH SOLID RESIDUE,",178.31,147.19,136.25,153.48
Minnesota,25,842420,SPRAY GUNS AND SIMILAR APPLIANCES,165.62,134.85,146.08,147.19
Missouri,0,0,World,13646.63,13934.57,14206.2,14499.77
Missouri,0,25,Top 25,5280.43,6191.5,6510.84,6267.57
Missouri,1,870431,"MTR VEH TRANS GDS SPK IG IN C P ENG, GVW NOV 5 MT",1155.84,1542.94,1755.25,1827.06
Missouri,2,880000,"CIVILIAN AIRCRAFT, ENGINES, AND PARTS",685.82,1327.77,797.25,776.99
Missouri,3,871150,"MOTORCYCLES, CYCL,EXCD 800 CC",237.55,335.38,349.78,368.29
Missouri,4,100590,"CORN (MAIZE), OTHER THAN SEED CORN",231.98,231.74,247.67,263.93
Missouri,5,230400,"SOYBEAN OILCAKE & OTH SOLID RESIDUE,",262.11,273.42,242.16,199.17
Missouri,6,260700,LEAD ORES AND CONCENTRATES,0,110.48,154.12,197.59
Missouri,7,740319,UNWROUGHT REFINED COPPER NESOI,118.01,64.6,199.7,195.38
Missouri,8,300490,"MEDICAMENTS NESOI, MEASURED DOSES, RETAIL PK NESOI",110.71,123.64,186.95,190.87
Missouri,9,300230,VACCINES FOR VETRINARY MEDICINE,336.53,318.68,207.81,176.61
Missouri,10,930690,BOMB MINES OT AMMNTION,191.9,161.01,227.29,163.22
Missouri,11,20329,"MEAT OF SWINE, NESOI, FROZEN",112.91,111.96,160.1,161.24
Missouri,12,210690,FOOD PREPARATIONS NESOI,173.56,165.38,134.72,158.9
Missouri,13,410411,"BOV/EQ HIDE/SKIN,FUL GRN,UNSPLIT;GRN SPL, WET STAT",204.63,173.5,185.8,155.06
Missouri,14,120190,"SOYBEANS, NESOI",164.37,215.4,190.68,150.37
Missouri,15,380892,"FUNGICIDES, EXC THOSE SPECIFIED IN SUBHEAD. NOTE 1",143.98,80.19,125.08,145.6
Missouri,16,220300,BEER MADE FROM MALT,146.51,131.01,114.57,137.95
Missouri,17,20319,"MEAT OF SWINE, NESOI, FRESH OR CHILLED",126.29,141.76,144.76,135.52
Missouri,18,293339,CMPDS CONT AN UNFUSED PYRIDINE RING ETC NESOI,156.39,128.8,230.42,135.22
Missouri,19,870421,"TRUCKS, NESOI, DIESEL ENG, GVW 5 M",58.4,82.48,130.05,126.65
Missouri,20,380893,"HERBCD, ANTISPROUT. PROD. & PLANT-GRWTH REG. NES",60.98,77.61,127.33,114.31
Missouri,21,230910,"DOG AND CAT FOOD, PUT UP FOR RETAIL SALE",98.81,92.97,104.65,107.14
Missouri,22,490199,"PRINTED BOOKS, BROCHURES, ETC., NESOI",73.03,85.65,102.99,99.05
Missouri,23,293399,HETEROCYCLIC COMP W NITROGEN HETERO-ATM ONLY NESOI,243.87,146.84,182.13,97.67
Missouri,24,382499,"PRODUCTS AND RESIDUALS OF CHEMICAL INDUSTRY, NESOI",0,0,107.51,93.02
Missouri,25,270112,"BITUMINOUS COAL, NOT AGGLOMERATED",186.25,68.27,102.06,90.74
Mississippi,0,0,World,10848.57,10504.7,10994.56,11808.27
Mississippi,0,25,Top 25,7088.25,6805.94,7022.81,8025.26
Mississippi,1,271019,PETROL OIL BITUM MINERA,2381.19,1903.25,2169.88,2279.15
Mississippi,2,320611,"PIGMNTS\PREPS CONT =>80% TITANIUM DIOXIDE, DRY WT",650.44,707.7,791.97,810.36
Mississippi,3,271012,"LT OILS, PREPS GT=70% PETRO",850.02,721.39,619.03,779.89
Mississippi,4,520100,"COTTON, NOT CARDED OR COMBED",296.34,280.35,471.7,646.3
Mississippi,5,470321,"CHEMICAL WOODPULP, SODA ETC. N DIS S BL & BL CONIF",471.44,449.24,427.8,476.15
Mississippi,6,901890,"INSTR & APPL F MEDICAL SURGICAL DENTAL VET, NESOI",171.84,256.99,255.46,424.98
Mississippi,7,901839,"MED NEEDLES. NESOI, CATHERERS ETC AND PARTS ETC",186.53,230.84,264.55,393.24
Mississippi,8,870324,PASS VEH SPK-IG INT COM RCPR P ENG > 3000 CC,434.73,412.09,375.91,295.44
Mississippi,9,870431,"MTR VEH TRANS GDS SPK IG IN C P ENG, GVW NOV 5 MT",197.35,211.31,240.19,247.11
Mississippi,10,851762,MACH FOR RECP/CONVR/TRANS/R,25.17,71.76,212.74,215.77
Mississippi,11,902131,ARTIFICIAL JOINTS AND PARTS AND ACCESSORIES THEROF,352.19,281.82,48.92,188.5
Mississippi,12,854239,"ELECTRONIC INTEGRATED CIRCUITS, NESOI",85.67,102.65,151.76,142.89
Mississippi,13,848120,VALVES F OLEOHYDRAULIC OR PNEUMATIC TRANSMISSIONS,137.27,161.19,139.66,137.78
Mississippi,14,271311,"PETROLEUM COKE, NOT CALCINED",77.76,63.03,101.83,118.36
Mississippi,15,846729,"TOOLS FOR WK IN  HAND,W/ SELF-CONT ELEC MOTOR,NESO",49.23,62.71,76.62,94.47
Mississippi,16,480411,"KRAFTLINER, UNCOATED UNBLEACHED IN ROLLS OR SHEETS",104.5,64.91,94.53,93.78
Mississippi,17,880000,"CIVILIAN AIRCRAFT, ENGINES, AND PARTS",96.21,178.13,122.28,90.6
Mississippi,18,871000,"TANK & OT ARMORED FIGHT VEH, MOTORIZED; AND PARTS",0.07,67.57,77.74,82.31
Mississippi,19,902110,"ORTHOPEDIC OR FRACTRE APPLIANCES, PARTS & ACCESSOR",101.5,91.36,65.24,82.12
Mississippi,20,854231,"PROCESSORS AND CONTROLLERS, ELECTRONIC INTEG CIRCT",63.78,60.38,63.17,75.71
Mississippi,21,890520,"FLOATING OR SUBMERSIBLE DRILLING OR PRODCTN,PLTFRM",143,209.46,0,75
Mississippi,22,840820,COMPRESSION-IGNTN INT COMBUST,15.78,36.22,59.5,73.52
Mississippi,23,843149,PARTS AND ATTACHMENTS NESOI FOR DERRI,56.19,54.38,63.97,72.98
Mississippi,24,20714,"CHICKEN CUTS AND EDIBLE OFFAL (INC LIVERS), FROZEN",76.06,74.96,81.6,71.07
Mississippi,25,940161,"SEATS W WOODEN FRAMES, UPHOLSTERED, NESOI",63.98,52.25,46.77,57.79
Montana,0,0,World,1404.09,1360.04,1616.01,1653.54
Montana,0,25,Top 25,891.88,947.36,1148.26,1233.59
Montana,1,240220,CIGARETTES CONTAINING TOBACCO,119.39,185.26,217.55,281.29
Montana,2,270119,"COAL NESOI, NOT AGGLOMERATED",123.55,19.18,151.15,155.02
Montana,3,282550,COPPER OXIDES AND HYDROXIDES,147.66,95.45,112.46,112.73
Montana,4,270112,"BITUMINOUS COAL, NOT AGGLOMERATED",0,16.7,53.67,82.25
Montana,5,285000,HYDRIDS/NITRIDS/AZIDS/SILICI,67.61,62.01,67.04,66.19
Montana,6,280461,SILICON CONTAIN BY WT NT < 99.99% OF SILICON,38.93,38.43,30.28,49.73
Montana,7,848620,MACHINES FOR MAN. SEMICONDUTOR DEVICES/ELEC IC,74.21,79.54,50.78,49.5
Montana,8,271012,"LT OILS, PREPS GT=70% PETRO",26.74,35.52,29.65,48.74
Montana,9,300290,HUMAN BLOOD; ANIMAL BLOOD PR,34.54,23.43,32.89,45.64
Montana,10,848690,"PARTS & ACCSESORIES FOR MACH TO MAN. SEMICNT, ETC",14.56,16.07,28.02,36.28
Montana,11,10229,"CATTLE, LIVE, OTHER THAN PUREBRED BREEDING",0.36,6.34,43.92,36.03
Montana,12,880000,"CIVILIAN AIRCRAFT, ENGINES, AND PARTS",19.56,96.37,27.18,34.27
Montana,13,382200,"COMPOSITE DIAGNOSTIC/LAB REAGENTS, EXC PHARMACEUT",6.13,13,19.39,29.24
Montana,14,252620,"NATURAL STEATITE AND TALC, CRUSHED OR POWDERED",26.11,26.51,27.8,26.95
Montana,15,252329,PORTLAND CEMENT EXCEPT WHITE PORTLAND CEMENT,37.5,35.6,33.98,26.48
Montana,16,71340,"LENTILS, DRIED SHELLED, INCLUDING SEED",52.71,95.87,102.07,22.19
Montana,17,261390,MOLYBDENUM ORES AND CONCENTRATES NOT ROASTED,13.37,0.85,16.05,21.42
Montana,18,100590,"CORN (MAIZE), OTHER THAN SEED CORN",1.53,2.6,2.57,19.97
Montana,19,252210,QUICKLIME,16.09,12.61,13.71,15.39
Montana,20,871639,TRAILERS & SEMI-TRAILER F TRANS CDS NESOI,11.05,6.83,5.58,14.51
Montana,21,71310,"PEAS, DRIED SHELLED, INCLUDING SEED",40.01,40.83,21.35,13.16
Montana,22,100199,"WHEAT AND MESLIN, NESOI",12.23,13.51,8.63,12.98
Montana,23,285390,OTHER INORG CMPDS;LQ/CMPRSD AIR;AMALG EXC PREC MET,0,0,7.42,12.13
Montana,24,903290,"PTS, AUTOM REGULATING/CONTROLLING INST & APPRTS",3.74,4.09,8.52,10.79
Montana,25,71320,"CHICKPEAS (GARBANZOS), DRIED SHELLED, INCLUDE SEED",4.3,20.75,36.59,10.72
North Carolina,0,0,World,30201.79,30180.14,32622.5,32729.77
North Carolina,0,25,Top 25,7943.83,8710.8,12047.87,12138.45
North Carolina,1,880000,"CIVILIAN AIRCRAFT, ENGINES, AND PARTS",1265.64,1418.49,1542.85,1970.93
North Carolina,2,300490,"MEDICAMENTS NESOI, MEASURED DOSES, RETAIL PK NESOI",960.93,1214.53,1158.72,1217.35
North Carolina,3,300215,"IMMUNOLOGICAL PRODUCTS, IN MEASURED DOESE/RTL SALE",0,0,1475.51,930.12
North Carolina,4,470321,"CHEMICAL WOODPULP, SODA ETC. N DIS S BL & BL CONIF",597.38,659.76,773.15,814.36
North Carolina,5,300212,ANTISERA AND OTHER BLOOD FRACTIONS,0,0,1068.57,610.6
North Carolina,6,240120,"TOBACCO, PARTLY OR WHOLLY STEMMED/STRIPPED",712.31,689.07,619.09,579.53
North Carolina,7,880330,"PARTS OF AIRPLANES OR HELICOPTERS, NESOI",524.43,993.66,522.88,572.87
North Carolina,8,930690,BOMB MINES OT AMMNTION,56.93,223.83,804.91,531.17
North Carolina,9,840820,COMPRESSION-IGNTN INT COMBUST,355.8,245.78,351.39,437.84
North Carolina,10,20329,"MEAT OF SWINE, NESOI, FROZEN",245.18,262.48,292.29,382.09
North Carolina,11,381512,SUPPORTED CATALYSTS W PREC METAL/PREC MTL COMPND,228.26,219.78,265.35,346.47
North Carolina,12,848340,GEARS; BALL OR ROLLER SC,55.6,28.27,194.82,331
North Carolina,13,847590,PARTS OF MACH FOR ASSMBL,227.34,276.92,272.28,327.71
North Carolina,14,520512,"COT YARN, 85% COT, NO RETAIL, OV 14NM NOT",386.67,329.93,341.38,322.9
North Carolina,15,842951,"MECH FRONT-END SHOVEL LOADERS, SELF-PROPELLED",316.63,229.51,221.6,300.7
North Carolina,16,854470,INSULATED OPTICAL FIBER CABLES WITH INDVULY SH FBR,286.63,258.96,241.23,297.58
North Carolina,17,300220,VACCINES FOR HUMAN MEDICINE,117.1,150.97,191.83,284.58
North Carolina,18,854140,PHOTOSNSITVE SEMICNDCTR DVICE INC PHTVLTC CELL ETC,409.67,328.03,322.35,268.32
North Carolina,19,550953,YRN N SW TH SYN ST FB N RT SL PLY S F MIX M/S,273.56,222.34,222.51,256.31
North Carolina,20,750512,"BARS, RODS AND PROFILES OF NICKEL ALLOYS",135.7,138.51,172.18,246.46
North Carolina,21,870850,DRIVE AXLES WITH DIFFERENTIAL FOR MOTOR VEHICLES,119.43,157.69,212.59,237.36
North Carolina,22,900110,"OPTICAL FIBERS, OPTICAL FIBER BUNDLES AND CABLES E",210.17,240.24,254.99,236.53
North Carolina,23,842952,MECH SHOVELS EXCAVATORS ETC W 360 DEGREE SPRSTRUC,127.89,73.76,146.51,226.85
North Carolina,24,848180,TAPS COCKS ETC F PIPE VAT INC THERMO CONTROL NESO,213.7,179.05,221.9,208.5
North Carolina,25,210690,FOOD PREPARATIONS NESOI,116.91,169.23,156.98,200.31
North Dakota,0,0,World,4027.22,5291.55,5835.49,6778.34
North Dakota,0,25,Top 25,2827.54,4184.26,4882.52,5865.99
North Dakota,1,271012,"LT OILS, PREPS GT=70% PETRO",232.78,200.12,1131.62,2326.06
North Dakota,2,270900,CRUDE OIL FROM PETROLEUM AND BITUMINOUS MINERALS,1352.19,2868.51,2275,1810.44
North Dakota,3,842951,"MECH FRONT-END SHOVEL LOADERS, SELF-PROPELLED",248.54,175.3,203.52,253.58
North Dakota,4,100590,"CORN (MAIZE), OTHER THAN SEED CORN",82.13,89.29,69.43,134.09
North Dakota,5,271113,"BUTANES, LIQUEFIED",62.27,43.77,68.19,129.1
North Dakota,6,870130,TRACK-LAYING TRACTORS,96.16,103.68,117.9,128.33
North Dakota,7,100199,"WHEAT AND MESLIN, NESOI",170.36,104.11,97.54,123.66
North Dakota,8,870195,"TRACTORS, EXCEEDING 130 KW",0,0,103.08,119.54
North Dakota,9,290110,"ACYCLIC HYDROCARBONS, SATURATED",67.82,60.98,87.31,101.12
North Dakota,10,220720,ETHYL ALCOHOL & OTH SPIRITS DENATURED ANY STRENGTH,69.66,108.84,115.58,90.99
North Dakota,11,230330,"BREWING OR DISTILLING DREGS AND WASTE, W/NT PELLET",61.95,66.33,65.36,74.67
North Dakota,12,382600,BIODIESEL AND MIXES CONTAIN,58.34,69.99,72.09,68.34
North Dakota,13,120510,LOW ERUCIC ACID RAPE/COLZA SEEDS W/NOT BROKEN,44.88,42.73,40.29,65.68
North Dakota,14,120190,"SOYBEANS, NESOI",45.31,24.62,53.9,58.11
North Dakota,15,842952,MECH SHOVELS EXCAVATORS ETC W 360 DEGREE SPRSTRUC,57.4,40.09,36.71,57.11
North Dakota,16,230400,"SOYBEAN OILCAKE & OTH SOLID RESIDUE,",29.6,38.47,30.03,51.24
North Dakota,17,843239,"SEEDERS, PLANTERS AND TRANSPLANTERS, NESOI",0,0,52.77,43.97
North Dakota,18,271121,"NATURAL GAS, GASEOUS",30.68,12.65,93.57,42.38
North Dakota,19,853710,CONTROLS ETC W ELECT APPR,19.68,16.45,29.3,33.12
North Dakota,20,71339,"BEANS NESOI, DRIED SHELLED, INCLUDING SEED",23,42.27,41.65,31.99
North Dakota,21,843290,AGRIC HORT/FOREST MACHY & LAWN/GROUND,20.2,25.73,23.4,28
North Dakota,22,843231,"NO-TILL DIRECT SEEDERS, PLANTERS AND TRANSPLANTERS",0,0,19.7,27.82
North Dakota,23,401012,CONVEYOR BELTS REINFORCED WITH TEXTILE MATERIALS,16.67,15.54,21.32,22.65
North Dakota,24,843139,"PTS FOR LIFTING, HNDLNG, LOADING/UNLDNG MACH NESOI",25.01,24.28,22.09,22.37
North Dakota,25,854430,INSULATED WIRING SETS FOR VEHICLES SHIPS AIRCRAFT,12.92,10.52,11.19,21.62
Nebraska,0,0,World,6663.67,6381.34,7206.42,7944.79
Nebraska,0,25,Top 25,3720.34,3822.92,4507.42,5209.68
Nebraska,1,20130,"MEAT OF BOVINE ANIMALS, BONELESS, FRESH OR CHILLED",489.53,489.06,602.47,592.22
Nebraska,2,20230,"MEAT OF BOVINE ANIMALS, BONELESS, FROZEN",376.73,378.09,377.47,531.62
Nebraska,3,120190,"SOYBEANS, NESOI",314.91,337.87,335.47,476.56
Nebraska,4,100590,"CORN (MAIZE), OTHER THAN SEED CORN",229.58,343.97,429.57,447.55
Nebraska,5,843351,COMBINE HARVESTER-THRESHERS,308.52,324.5,430.96,382.84
Nebraska,6,230400,"SOYBEAN OILCAKE & OTH SOLID RESIDUE,",63.99,154.28,138.69,347.24
Nebraska,7,271121,"NATURAL GAS, GASEOUS",173.52,99.05,210.78,331.52
Nebraska,8,20319,"MEAT OF SWINE, NESOI, FRESH OR CHILLED",146.6,144.62,198.78,181.82
Nebraska,9,380891,"INSECTICIDES, EXC THOSE SPECIFIED IN SUBHEAD. NT 1",65.87,80.56,91.61,180.33
Nebraska,10,410150,"WHOLE HIDES & SKINS, OF A WT >16KG BOVINE/EQUINE",258.98,255.76,260.71,171.52
Nebraska,11,20329,"MEAT OF SWINE, NESOI, FROZEN",170.03,157.86,159.03,165.37
Nebraska,12,901831,"SYRINGES, WITH OR WITHOUT NEEDLES; PTS & ACCESS",95.53,132.58,138.76,155.66
Nebraska,13,842482,"MECH APS FOR AG/HORT FOR PROJECT/SPRAY/ETC, NESOI",0,0,156.89,147.48
Nebraska,14,300230,VACCINES FOR VETRINARY MEDICINE,149.52,131.98,130.34,147.17
Nebraska,15,20220,"MEAT, BOVINE CUTS WITH BONE IN, FROZEN",102.26,95.65,112.81,133.63
Nebraska,16,170260,"FRUCTOSE, NESOI & SYRU",68.29,118.35,113.05,122.62
Nebraska,17,380892,"FUNGICIDES, EXC THOSE SPECIFIED IN SUBHEAD. NOTE 1",62.1,56.43,54.77,85.79
Nebraska,18,390770,"POLY(LACTIC) ACID, IN PRIMARY FORMS",46.36,33.86,53.94,83.19
Nebraska,19,410411,"BOV/EQ HIDE/SKIN,FUL GRN,UNSPLIT;GRN SPL, WET STAT",142.94,111.32,94.42,80.78
Nebraska,20,230310,RESIDUES OF STARCH MFR AND SIMILAR RESIDUES,9.28,41.72,70.56,77.17
Nebraska,21,853690,ELECT APPR F PRTCT TO ELECT CIR,174.87,114,84.01,74.91
Nebraska,22,20610,"OFFAL OF BOVINE ANIMALS, EDIBLE, FRESH OR CHILLED",47.51,62.78,69.69,74.76
Nebraska,23,230910,"DOG AND CAT FOOD, PUT UP FOR RETAIL SALE",48.38,43.32,54.41,74.27
Nebraska,24,380893,"HERBCD, ANTISPROUT. PROD. & PLANT-GRWTH REG. NES",56.62,31.06,65.2,71.98
Nebraska,25,230990,"ANIMAL FEED PREP EXCEPT DOG OR CAT FOOD, RETAIL PK",118.4,84.27,73,71.67
New Hampshire,0,0,World,4001.32,4143.67,5147.88,5285.59
New Hampshire,0,25,Top 25,1485.26,1667.54,2564.5,3003.17
New Hampshire,1,880000,"CIVILIAN AIRCRAFT, ENGINES, AND PARTS",75.87,235.18,493.85,835.18
New Hampshire,2,300390,"MEDICAMENTS NESOI, NOT IN DOSAGE FO",9,125.64,265.63,314.81
New Hampshire,3,844399,"PTS & ACC OF PRINTERS, COPIERS AND FAX MACH, NESOI",203.24,231.24,248.94,214.29
New Hampshire,4,851762,MACH FOR RECP/CONVR/TRANS/R,128.81,155.09,331.71,182.28
New Hampshire,5,846693,PARTS AND ACCESSORIES FOR USE WITH MA,141.17,130.25,144.81,167.45
New Hampshire,6,851712,PHONES FOR CELLULAR NTWKS OR FOR OTH WIRELESS NTWK,288.2,156.71,115.73,113.18
New Hampshire,7,851770,PTS OF PHONE SETS & OTH APP FOR THE TRANS/RECP ETC,179.56,137.28,113.33,101.54
New Hampshire,8,392690,"ARTICLES OF PLASTICS, NESOI",49.25,58.94,55.5,77.04
New Hampshire,9,711299,WASTE AND SCRAP OF PRECIOUS METAL NESOI,63.44,64.39,63.87,75.14
New Hampshire,10,900510,BINOCULARS,13.44,57.1,55.76,74.31
New Hampshire,11,300214,"IMMUNOLOGICAL PRODUCTS, MIXED, NOT IN MSRED DOSES",0,0,57.1,74.24
New Hampshire,12,845640,"MACH TOOLS, REMOVE MAT BY PLASMA ARC PROCESSES",0,0,58.68,73.89
New Hampshire,13,844332,"PRINTERS/ COPIERS/FAX MACH, NT",84.52,57.8,84.8,71.58
New Hampshire,14,852990,"PTS,EX ANTENNA,FOR TRNSMSSN,",69.73,27.33,75.12,70.82
New Hampshire,15,841191,TURBOJET AND TURBOPROLLER PARTS,1.32,4.86,37.73,68.36
New Hampshire,16,930200,"REVOLVERS & PISTOLS, DESIGNED TO FIRE LIVE AMMO",18.43,41.5,41.85,64.02
New Hampshire,17,930120,"RKT LAUNCH.,FLAMTHROW, & SIM. PROJECTORS(MILITARY)",0,0.05,0,61.11
New Hampshire,18,848340,GEARS; BALL OR ROLLER SC,13.48,17.65,31.21,54.51
New Hampshire,19,491199,"PRINTED MATTER, NESOI",0.44,17.41,77.86,49.06
New Hampshire,20,845811,HORIZONTAL LATHES FOR REMOVNG MET NUMRCAL CONTROLD,28.41,24.78,34.31,47.59
New Hampshire,21,30632,"LOBSTERS, LIVE, FRESH,OR CHILLED",0,0,33.09,44.76
New Hampshire,22,901580,SURVEYING INSTRUMENTS,39.58,37.25,43.47,44.3
New Hampshire,23,853921,TUNGSTEN HALOGEN ELECTRIC FILAMENT LAMPS,31.02,36.1,38.57,44.12
New Hampshire,24,854231,"PROCESSORS AND CONTROLLERS, ELECTRONIC INTEG CIRCT",20.28,23.76,33.16,43.55
New Hampshire,25,841981,MACHINERY ETC FOR MAKING HOT DRINKS COOKING HEATNG,26.07,27.23,28.41,36.06
New Jersey,0,0,World,32063,31177.53,34486.25,35662.51
New Jersey,0,25,Top 25,10624.84,10625.28,12899.69,13301.09
New Jersey,1,271019,PETROL OIL BITUM MINERA,1245.36,1698.99,2054.41,1205.51
New Jersey,2,711021,"PALLADIUM, UNWROUGHT OR IN POWDER FORM",678.75,365.19,465.58,1007.25
New Jersey,3,880000,"CIVILIAN AIRCRAFT, ENGINES, AND PARTS",720.88,732.28,801.38,833.72
New Jersey,4,870323,PASS VEH SPK-IG INT COM R,322.53,491.89,503.69,828.21
New Jersey,5,720449,FERROUS WASTE & SCRAP NESOI,471.78,476.57,667.69,796.28
New Jersey,6,330499,BEAUTY & SKIN CARE PREPARATI,461.38,472.73,675.22,750.24
New Jersey,7,711319,"JEWELRY AND PARTS THEREOF, OF OTH PRECIOUS METAL",1090.21,630.96,1085.98,743.84
New Jersey,8,711299,WASTE AND SCRAP OF PRECIOUS METAL NESOI,51.68,115.97,349.32,721.88
New Jersey,9,851712,PHONES FOR CELLULAR NTWKS OR FOR OTH WIRELESS NTWK,655.35,653.32,836.76,706.16
New Jersey,10,901890,"INSTR & APPL F MEDICAL SURGICAL DENTAL VET, NESOI",179.58,154.65,210.28,660.95
New Jersey,11,847180,"AUTOMATIC DATA PROCESSING UNITS, N.E.S.O.I.",330.73,493.35,774.82,588.31
New Jersey,12,300490,"MEDICAMENTS NESOI, MEASURED DOSES, RETAIL PK NESOI",552.71,554.66,521.51,467.83
New Jersey,13,330300,PERFUMES AND TOILET WATERS,336.66,346.05,349.75,374.99
New Jersey,14,880330,"PARTS OF AIRPLANES OR HELICOPTERS, NESOI",424.28,454.81,398.4,337.92
New Jersey,15,330210,MIXTURES ODORIFEROUS SU,247.64,267.52,285.34,321.89
New Jersey,16,851762,MACH FOR RECP/CONVR/TRANS/R,297.05,270.09,308.07,319.87
New Jersey,17,847330,PARTS & ACCESSORIES FOR ADP M,275.25,396.45,356.21,319.84
New Jersey,18,490199,"PRINTED BOOKS, BROCHURES, ETC., NESOI",322.51,297.41,315.95,312.81
New Jersey,19,711292,PLAT WST A SCRP NT CNTNG OTH PREC MTLS,658.85,529.33,440.78,295.93
New Jersey,20,382200,"COMPOSITE DIAGNOSTIC/LAB REAGENTS, EXC PHARMACEUT",181.4,225.38,256.02,294.29
New Jersey,21,711031,"RHODIUM, UNWROUGHT OR IN POWDER FORM",138.55,94.86,142.15,293.56
New Jersey,22,847130,PORT DIGTL AUTOMATIC DA,211.14,167.27,228,293.55
New Jersey,23,711011,"PLATINUM, UNWROUGHT OR POWDER",277.21,250.19,281.95,288.05
New Jersey,24,381512,SUPPORTED CATALYSTS W PREC METAL/PREC MTL COMPND,213.47,229.99,321.86,269.35
New Jersey,25,381121,ADDITIVE FOR LUB OIL CONT PETRO/BITUMINOUS MINOIL,279.88,255.37,268.56,268.86
New Mexico,0,0,World,3781.7,3616.16,3609.59,3654.79
New Mexico,0,25,Top 25,2660.64,2599.5,2590.54,2664.2
New Mexico,1,854231,"PROCESSORS AND CONTROLLERS, ELECTRONIC INTEG CIRCT",1083.72,867.96,713.64,800.43
New Mexico,2,847330,PARTS & ACCESSORIES FOR ADP M,795.39,668.99,665.28,522.36
New Mexico,3,901890,"INSTR & APPL F MEDICAL SURGICAL DENTAL VET, NESOI",68.36,94.68,215.56,196.75
New Mexico,4,852610,RADAR APPARATUS,0.15,141.3,0.14,178.82
New Mexico,5,880000,"CIVILIAN AIRCRAFT, ENGINES, AND PARTS",59.56,84.26,95.85,102.87
New Mexico,6,847170,"AUTOMATIC DATA PROCESSING STORAGE UNITS, N.E.S.O.I",52.76,39.92,72.13,94.48
New Mexico,7,851762,MACH FOR RECP/CONVR/TRANS/R,103.97,94.82,128.17,88.23
New Mexico,8,848180,TAPS COCKS ETC F PIPE VAT INC THERMO CONTROL NESO,64.34,59.19,50.97,57.13
New Mexico,9,854239,"ELECTRONIC INTEGRATED CIRCUITS, NESOI",2.3,1.68,14.84,54.24
New Mexico,10,381800,"CHEM ELEM DOPED, USED IN ELECT",28.94,30.01,48.43,51.83
New Mexico,11,930690,BOMB MINES OT AMMNTION,43.4,93.33,135.81,47.61
New Mexico,12,392690,"ARTICLES OF PLASTICS, NESOI",52.64,50.73,47.21,43.74
New Mexico,13,841330,"FUEL, LUB/COOLING MED PUMPS FOR INT COMB PISTN ENG",36.43,53.54,54.34,42.91
New Mexico,14,310490,"MINERAL OR CHEMICAL FERTILIZER, POTASSIC, NESOI",23.17,43.18,24.93,42.46
New Mexico,15,854140,PHOTOSNSITVE SEMICNDCTR DVICE INC PHTVLTC CELL ETC,30.13,21.57,25.86,41.13
New Mexico,16,40210,"MLK & CRM,CNTD,SWT,POWDR,GR",30.28,35.08,31.67,37.6
New Mexico,17,392113,"PLATES, SHEETS ETC. NESOI, CELLULAR POLYURETHANES",19.12,18.72,25.17,36.61
New Mexico,18,80290,"NUTS NESOI, FRESH OR DRIED, SHELLED OR NOT",7.52,28.14,49.37,35.6
New Mexico,19,740400,COPPER WASTE AND SCRAP,28.89,19.88,29.62,34.6
New Mexico,20,854442,"ELEC CONDUCTORS, LT=1000 V, W/ CONNECTORS, NESOI",39.05,63.76,35.89,33.72
New Mexico,21,710692,"SILVER, SEMIMANUFACTURED",18.85,22.82,25.49,27.24
New Mexico,22,732690,ARTICLES OF IRON OR STEEL NESOI,34.44,37.29,32.08,26.13
New Mexico,23,850440,STATIC CONVERTERS; ADP POWER SUPPLIES,28.96,19.29,29.99,23.97
New Mexico,24,40690,"CHEESE, NESOI, INCLUDING CHEDDAR AND COLBY",8.29,9.37,15.01,21.95
New Mexico,25,382499,"PRODUCTS AND RESIDUALS OF CHEMICAL INDUSTRY, NESOI",0,0,23.1,21.78
Nevada,0,0,World,8666.52,9765.63,12162.49,11084.53
Nevada,0,25,Top 25,6525.26,7401.07,9979.86,8814.34
Nevada,1,710812,"GOLD, NONMONETARY, UNWROUGHT NESOI",3941.22,4592.26,6285.36,4918.2
Nevada,2,950430,GAMES COIN-/TOKEN-OPERATED EXC BOWLING ALLEY NESOI,443.66,573.5,624.11,719.78
Nevada,3,854239,"ELECTRONIC INTEGRATED CIRCUITS, NESOI",370.38,382.52,501.92,552.4
Nevada,4,260300,COPPER ORES AND CONCENTRATES,326.92,358.83,364.67,445.53
Nevada,5,854231,"PROCESSORS AND CONTROLLERS, ELECTRONIC INTEG CIRCT",172.19,194.37,282.38,320.99
Nevada,6,711890,"COIN, NESOI",3.39,109.18,230.78,242.27
Nevada,7,851712,PHONES FOR CELLULAR NTWKS OR FOR OTH WIRELESS NTWK,57.92,63.46,100.75,184.97
Nevada,8,880000,"CIVILIAN AIRCRAFT, ENGINES, AND PARTS",114.55,138.78,159.83,178.9
Nevada,9,903180,"MEAS & CHECKNG INSTRUMENT, APPLIANCES & MACH NESOI",155.32,141.1,144.28,147.38
Nevada,10,850760,LITHIUM ION BATTERIES,2.81,19.53,97.24,130.71
Nevada,11,710239,"DIAMONDS, NONINDUSTRIAL, WORKED",403.06,256.93,449.6,127.93
Nevada,12,841370,"CENTRIFUGAL PUMPS, NESOI",42.96,78.25,54.34,90.18
Nevada,13,854232,"MEMORIES, ELECTRONIC INTEGRATED CIRCUITS",82.87,70.14,88.16,88.97
Nevada,14,90121,"COFFEE, ROASTED, NOT DECAFFEINATED",50.04,73.35,83.93,88.46
Nevada,15,300212,ANTISERA AND OTHER BLOOD FRACTIONS,0,0,96.45,78.4
Nevada,16,851762,MACH FOR RECP/CONVR/TRANS/R,28.59,44.62,54.32,66.87
Nevada,17,902290,X-RAY/HI TNSN GENR CNTR PNL,45.57,42.36,44.22,58.7
Nevada,18,261690,"PRECIOUS METAL ORES & CONCENTRATES, EXCEPT SILVER",1.01,4.33,0.77,57.12
Nevada,19,854140,PHOTOSNSITVE SEMICNDCTR DVICE INC PHTVLTC CELL ETC,50.97,42.23,53.39,48.46
Nevada,20,847330,PARTS & ACCESSORIES FOR ADP M,15.04,18.97,35.89,48.28
Nevada,21,711319,"JEWELRY AND PARTS THEREOF, OF OTH PRECIOUS METAL",74.31,44.22,54.24,47.33
Nevada,22,854129,"TRANSISTORS, OTHER THAN PHOTOSENSITIVE, NESOI",27.85,45.44,50.13,46.24
Nevada,23,848180,TAPS COCKS ETC F PIPE VAT INC THERMO CONTROL NESO,36.46,33.4,34.7,43.87
Nevada,24,854233,"AMPLIFIERS, ELECTRONIC INTEGRATED CIRCUITS",33.01,51.52,50.32,42.42
Nevada,25,40221,MLK/CREAM CNCTRD NT SWTN PWD/OTH SOLIDS OV,45.17,21.79,38.08,39.98
New York,0,0,World,83124.55,76690.18,77914.56,81487.26
New York,0,25,Top 25,43330.82,39979.03,40780.81,45737.83
New York,1,710239,"DIAMONDS, NONINDUSTRIAL, WORKED",12656.1,12440.16,12050.39,13347.35
New York,2,970110,"PAINTINGS, DRAWING AND PASTELS BY HAND",6976.22,6810.11,7034.68,8491.96
New York,3,711319,"JEWELRY AND PARTS THEREOF, OF OTH PRECIOUS METAL",6004.9,5690.25,5919.93,5689.09
New York,4,710812,"GOLD, NONMONETARY, UNWROUGHT NESOI",6753.7,5054.18,3708.97,5245.26
New York,5,710391,"RUBIES, SAPPHIRES AND EMERALDS, OTHERWISE WORKED",1080.13,1040.93,1391.63,1546.87
New York,6,970300,"ORIGINAL SCULPTURES AND STATUARY, IN ANY MATERIAL",1426.24,1372.28,1196.59,1391.06
New York,7,880000,"CIVILIAN AIRCRAFT, ENGINES, AND PARTS",1175.59,1057.88,1416.18,1215.17
New York,8,854231,"PROCESSORS AND CONTROLLERS, ELECTRONIC INTEG CIRCT",253.64,324.06,807.75,896.05
New York,9,840820,COMPRESSION-IGNTN INT COMBUST,584.8,442.29,518.37,814.4
New York,10,851712,PHONES FOR CELLULAR NTWKS OR FOR OTH WIRELESS NTWK,915.32,592.1,739.81,657.91
New York,11,851762,MACH FOR RECP/CONVR/TRANS/R,540.79,470.79,626.29,598.76
New York,12,870323,PASS VEH SPK-IG INT COM R,802.91,475.26,426.39,576.72
New York,13,760612,"ALUMINUM ALLOY RECT PLATES ETC, OVER .2 MM THICK",574.5,535.99,570.73,565.96
New York,14,970600,ANTIQUES OF AN AGE EXCEEDING ONE HUNDRED YEARS,611.46,513.73,475.76,538.85
New York,15,271121,"NATURAL GAS, GASEOUS",491.85,359.54,434.9,531.11
New York,16,710231,DIAM EX IND UNWKD OR SMPL SWN CLVD OR BRUTED,191.3,602.05,896.72,476.57
New York,17,271019,PETROL OIL BITUM MINERA,316.52,266.31,241.13,397.63
